{
  "contract": "anibench.cross-domain-collection-input.v1",
  "question": {
    "contract": "anibench.cross-domain-question.v1",
    "question_id": "source_inspired_activity_and_reaction.v1",
    "question": "Can linked activity and cognitive measurements resolve their individual changes and population relationship?",
    "population_scope": "Hypothetical independent adult sample; not UK Biobank participant data",
    "coordinates": [
      {
        "id": "activity",
        "unit": "milli-gravity",
        "definition": "Overall wrist acceleration average using the UK Biobank field90012 definition and its calibration/wear-time eligibility; each occasion summarizes its specified monitoring window",
        "biological_domain": "digital",
        "role": "observer"
      },
      {
        "id": "reaction_time",
        "unit": "ms",
        "definition": "UK Biobank field20023 matching-card reaction-time summary: exclude training rounds0-4 and responses outside50-2000ms, retain matching-card responses, round mean to wholems; not general intelligence",
        "biological_domain": "cognitive",
        "role": "function"
      }
    ],
    "occasions_days": [
      0,
      365
    ],
    "tolerances": {
      "observer_state": [
        3
      ],
      "function_state": [
        25
      ],
      "observer_change": [
        4
      ],
      "function_change": [
        35
      ],
      "observer_mean_change": [
        1
      ],
      "function_mean_change": [
        10
      ],
      "change_cross_covariance": [
        300
      ],
      "controlled_function_effect": [
        20
      ]
    },
    "tolerance_authority": "Illustrative native resolutions chosen for a reproducible software example; not clinical thresholds or adopted AniBench level. Joint observer/function criteria retain separate units.",
    "functional_operator": "Separate computerized reaction measurement with a declared additive-error approximation to the occasion summary. Validity of that approximation is stipulated, not calibrated from the source."
  },
  "scenario": {
    "question_sha256": "sha256:2dea72a3b5a60ee22e716e0909071ce24ae5d88cda0972634acd47bdf9a17c48",
    "biological_covariance": [
      [
        100,
        0,
        70,
        500
      ],
      [
        0,
        10000,
        0,
        5000
      ],
      [
        70,
        0,
        100,
        350
      ],
      [
        500,
        5000,
        350,
        10000
      ]
    ],
    "measurement_error_covariance": [
      [
        4,
        0,
        0,
        0
      ],
      [
        0,
        400,
        0,
        0
      ],
      [
        0,
        0,
        4,
        0
      ],
      [
        0,
        0,
        0,
        400
      ]
    ],
    "error_covariance_treated_as_known": true,
    "assumptions": [
      "Invented joint Gaussian deviations around unspecified means, independent people, known additive error independent of biological variation.",
      "B is a synthetic covariance generated by independent baseline states and independent follow-up innovations: standardized observer1=.7observer0+sqrt(.51)e; function1=.5observer0+.5function0+sqrt(.5)e.",
      "The two source-native measurement definitions are combined in a hypothetical aligned two-occasion design. The sources do not establish this joint roster, cadence, covariance, sample size, error model or predicted gain.",
      "The Gaussian approximation to averaged activity and reaction-time summaries needs empirical checking; these calculations do not establish actual support or tails."
    ]
  },
  "design": {
    "question_sha256": "sha256:2dea72a3b5a60ee22e716e0909071ce24ae5d88cda0972634acd47bdf9a17c48",
    "lifecycle": "hypothetical",
    "n_people": 256,
    "closed_pattern_roster": true,
    "patterns_are_disjoint": true,
    "homogeneous_reference_across_patterns": true,
    "acquisition_independent_of_state": true,
    "patterns": [
      {
        "pattern_id": "complete",
        "n_people": 256,
        "closed_acquisition_inventory": true,
        "controlled_arm_counts": null,
        "acquisitions": [
          {
            "physical_id": "activity-0",
            "occasion_index": 0,
            "outputs": [
              {
                "coordinate_id": "activity",
                "qualified": true
              }
            ]
          },
          {
            "physical_id": "reaction_time-0",
            "occasion_index": 0,
            "outputs": [
              {
                "coordinate_id": "reaction_time",
                "qualified": true
              }
            ]
          },
          {
            "physical_id": "activity-1",
            "occasion_index": 1,
            "outputs": [
              {
                "coordinate_id": "activity",
                "qualified": true
              }
            ]
          },
          {
            "physical_id": "reaction_time-1",
            "occasion_index": 1,
            "outputs": [
              {
                "coordinate_id": "reaction_time",
                "qualified": true
              }
            ]
          }
        ]
      }
    ],
    "support": {
      "collection_verified": null,
      "controlled_assignment_identified": false,
      "cross_domain_linkage": true,
      "declared_population": true,
      "documented_exposure": false,
      "exposure_aligned_window": false,
      "gaussian_reference": true,
      "independent_measurement_error": true,
      "independent_people": true,
      "independently_measured_function": true,
      "operator_valid": true,
      "paired_occasions": true,
      "prediction_time_order": true,
      "reference_model_applicable": true,
      "zero_mean_measurement_error": true
    },
    "metadata": {
      "name": "Hypothetical activity/cognition design",
      "source_definitions": [
        "https://biobank.ndph.ox.ac.uk/ukb/field.cgi?id=90012",
        "https://biobank.ndph.ox.ac.uk/ukb/field.cgi?id=20023"
      ],
      "actual_study_score": false
    }
  }
}
